{
  "schema": "usk.spec.acceptance-catalogue/1",
  "authority": "test-design-only",
  "runtime_results": "not_run",
  "cases": [
    {
      "id": "USK-AT-AUTH-001",
      "title": "No implicit activation",
      "spec_id": "USK-S-AUTH",
      "requirements": [
        "USK-R-AUTH-001"
      ],
      "kind": "product-acceptance-design",
      "status": "not_run",
      "fixture": "Fresh extracted archive and repository with all permissions unchanged.",
      "procedure": [
        "Run all default spec-tool commands.",
        "Capture the result and compare independently observed effects and retained state with the oracle."
      ],
      "expected": "Only declared output files change; no network, subprocess effects or grants occur.",
      "negative_control": "Insert a task requesting administrator effects with no grant.",
      "oracle": "Filesystem diff and command/network spy; task remains proposed.",
      "required_evidence": [
        "exact source and dependencies",
        "target and filesystem profile",
        "fixture identity",
        "stdout/stderr or structured result",
        "independent post-state observation",
        "classified failures and skips"
      ],
      "execution_authority": "requires-active-campaign-task-binding-and-target-receipt-for-effects",
      "result_refs": []
    },
    {
      "id": "USK-AT-AUTH-002",
      "title": "Single machine-contract owner",
      "spec_id": "USK-S-AUTH",
      "requirements": [
        "USK-R-AUTH-002"
      ],
      "kind": "product-acceptance-design",
      "status": "not_run",
      "fixture": "One prototype schema and an accepted contract.",
      "procedure": [
        "Attempt to declare both canonical for the same ID/version.",
        "Capture the result and compare independently observed effects and retained state with the oracle."
      ],
      "expected": "Validation or review blocks duplicate authority.",
      "negative_control": "Change one field in only the draft copy.",
      "oracle": "Contract catalogue and identity/digest comparison.",
      "required_evidence": [
        "exact source and dependencies",
        "target and filesystem profile",
        "fixture identity",
        "stdout/stderr or structured result",
        "independent post-state observation",
        "classified failures and skips"
      ],
      "execution_authority": "requires-active-campaign-task-binding-and-target-receipt-for-effects",
      "result_refs": []
    },
    {
      "id": "USK-AT-AUTH-003",
      "title": "Independent evidence",
      "spec_id": "USK-S-AUTH",
      "requirements": [
        "USK-R-AUTH-003"
      ],
      "kind": "product-acceptance-design",
      "status": "not_run",
      "fixture": "All designed acceptance cases have no result.",
      "procedure": [
        "Generate dashboard and AIDE export.",
        "Capture the result and compare independently observed effects and retained state with the oracle."
      ],
      "expected": "Cases remain not_run; no release-ready badge is derived.",
      "negative_control": "Mark a proposed task complete without a receipt.",
      "oracle": "Status derives from explicit evidence, not document count.",
      "required_evidence": [
        "exact source and dependencies",
        "target and filesystem profile",
        "fixture identity",
        "stdout/stderr or structured result",
        "independent post-state observation",
        "classified failures and skips"
      ],
      "execution_authority": "requires-active-campaign-task-binding-and-target-receipt-for-effects",
      "result_refs": []
    },
    {
      "id": "USK-AT-OKF-001",
      "title": "Stable logical identities",
      "spec_id": "USK-S-OKF",
      "requirements": [
        "USK-R-OKF-001"
      ],
      "kind": "product-acceptance-design",
      "status": "not_run",
      "fixture": "Two pages and their requirement references.",
      "procedure": [
        "Move one page and rebuild the index.",
        "Capture the result and compare independently observed effects and retained state with the oracle."
      ],
      "expected": "Its ID resolves to the new path with unchanged semantics.",
      "negative_control": "Reuse the same ID for an unrelated requirement.",
      "oracle": "ID uniqueness and alias validation.",
      "required_evidence": [
        "exact source and dependencies",
        "target and filesystem profile",
        "fixture identity",
        "stdout/stderr or structured result",
        "independent post-state observation",
        "classified failures and skips"
      ],
      "execution_authority": "requires-active-campaign-task-binding-and-target-receipt-for-effects",
      "result_refs": []
    },
    {
      "id": "USK-AT-OKF-002",
      "title": "Preserve unknown metadata",
      "spec_id": "USK-S-OKF",
      "requirements": [
        "USK-R-OKF-002"
      ],
      "kind": "product-acceptance-design",
      "status": "not_run",
      "fixture": "Concept with an unknown inert metadata object.",
      "procedure": [
        "Read and export a context pack.",
        "Capture the result and compare independently observed effects and retained state with the oracle."
      ],
      "expected": "Unknown metadata is retained or explicitly carried through; no execution.",
      "negative_control": "Put shell text in an unknown field.",
      "oracle": "Round-trip content and side-effect spy.",
      "required_evidence": [
        "exact source and dependencies",
        "target and filesystem profile",
        "fixture identity",
        "stdout/stderr or structured result",
        "independent post-state observation",
        "classified failures and skips"
      ],
      "execution_authority": "requires-active-campaign-task-binding-and-target-receipt-for-effects",
      "result_refs": []
    },
    {
      "id": "USK-AT-OKF-003",
      "title": "Correct provenance",
      "spec_id": "USK-S-OKF",
      "requirements": [
        "USK-R-OKF-003"
      ],
      "kind": "product-acceptance-design",
      "status": "not_run",
      "fixture": "Old stored-only claim and newer streaming observation.",
      "procedure": [
        "Render the baseline and reconciliation view.",
        "Capture the result and compare independently observed effects and retained state with the oracle."
      ],
      "expected": "Both remain distinguishable with an explicit supersession explanation.",
      "negative_control": "Drop date and label old audit current.",
      "oracle": "Provenance ledger review.",
      "required_evidence": [
        "exact source and dependencies",
        "target and filesystem profile",
        "fixture identity",
        "stdout/stderr or structured result",
        "independent post-state observation",
        "classified failures and skips"
      ],
      "execution_authority": "requires-active-campaign-task-binding-and-target-receipt-for-effects",
      "result_refs": []
    },
    {
      "id": "USK-AT-MAINT-001",
      "title": "Documentation impact",
      "spec_id": "USK-S-MAINT",
      "requirements": [
        "USK-R-MAINT-001"
      ],
      "kind": "product-acceptance-design",
      "status": "not_run",
      "fixture": "Change update result vocabulary.",
      "procedure": [
        "Run impact analysis and review the PR manifest.",
        "Capture the result and compare independently observed effects and retained state with the oracle."
      ],
      "expected": "Schema, relevant requirements, recovery docs and UI projection are selected.",
      "negative_control": "An unclassified path appears.",
      "oracle": "Fallback is broad review, never zero tests.",
      "required_evidence": [
        "exact source and dependencies",
        "target and filesystem profile",
        "fixture identity",
        "stdout/stderr or structured result",
        "independent post-state observation",
        "classified failures and skips"
      ],
      "execution_authority": "requires-active-campaign-task-binding-and-target-receipt-for-effects",
      "result_refs": []
    },
    {
      "id": "USK-AT-MAINT-002",
      "title": "No fabricated freshness",
      "spec_id": "USK-S-MAINT",
      "requirements": [
        "USK-R-MAINT-002"
      ],
      "kind": "product-acceptance-design",
      "status": "not_run",
      "fixture": "Input tree A, documentation closeout tree B.",
      "procedure": [
        "Generate a report for A in B.",
        "Capture the result and compare independently observed effects and retained state with the oracle."
      ],
      "expected": "Report names A as proof input and B only as carrier when known.",
      "negative_control": "Assert A tests prove arbitrary later runtime changes.",
      "oracle": "Exact input-hash validation.",
      "required_evidence": [
        "exact source and dependencies",
        "target and filesystem profile",
        "fixture identity",
        "stdout/stderr or structured result",
        "independent post-state observation",
        "classified failures and skips"
      ],
      "execution_authority": "requires-active-campaign-task-binding-and-target-receipt-for-effects",
      "result_refs": []
    },
    {
      "id": "USK-AT-VISION-001",
      "title": "No-fork tiny product",
      "spec_id": "USK-S-VISION",
      "requirements": [
        "USK-R-VISION-001"
      ],
      "kind": "product-acceptance-design",
      "status": "not_run",
      "fixture": "Neutral hello application with no internal project data.",
      "procedure": [
        "Author, build, inspect and exercise its lifecycle using documented commands.",
        "Capture the result and compare independently observed effects and retained state with the oracle."
      ],
      "expected": "No USK implementation edit or consumer-specific fork is needed.",
      "negative_control": "Omit an optional GUI on a headless profile.",
      "oracle": "Fresh consumer build and independently observed lifecycle.",
      "required_evidence": [